{
  "schema_version": 1,
  "locale": "cu",
  "name": "Church Slavonic",
  "topics": {
    "adultery": "Прелюбодеяние",
    "authority-of-the-bible": "Авторитет Библии",
    "baptism": "Крещение",
    "biblical-love": "Библейская любовь",
    "blessings-and-curses": "Благословения и проклятия",
    "christian-clothing": "Христианская одежда",
    "christian-offices": "Христианские служения",
    "communion": "Причастие",
    "conditional-security": "Условная уверенность в спасении",
    "dating": "Добрачные отношения",
    "dietary-guidance": "Наставления о питании",
    "discipline": "Дисциплина",
    "education": "Образование",
    "effective-prayer": "Действенная молитва",
    "family-planning": "Планирование семьи",
    "fear-not": "Не бойся",
    "first-day": "Первый день",
    "flattery": "Лесть",
    "free-will": "Свободная воля",
    "gods-judgment": "Божий суд",
    "grace": "Благодать",
    "home-church": "Домашняя церковь",
    "immutability": "Неизменность",
    "jesus-christs-deity": "Божественность Иисуса Христа",
    "jesus-christs-humanity": "Человеческая природа Иисуса Христа",
    "leadership": "Лидерство",
    "longevity": "Долголетие",
    "mans-role": "Роль мужчины",
    "marriage": "Брак",
    "musics-influence": "Влияние музыки",
    "no-fellowship": "Нет общения",
    "no-one-is-good": "Никто не благ",
    "non-resistance": "Непротивление",
    "not-under-the-law": "Не под законом",
    "obey-gods-commandments": "Послушание Божьим заповедям",
    "obey-government-laws": "Соблюдение государственных законов",
    "omnipotent": "Всемогущий",
    "omnipresent": "Вездесущий",
    "omniscient": "Всеведущий",
    "orderly-home": "Порядок в доме",
    "ordinances": "Установления",
    "prince-of-this-world": "Князь мира сего",
    "providence": "Провидение",
    "renewing-of-the-mind": "Обновление ума",
    "repentance": "Покаяние",
    "saved-by-faith": "Спасение по вере",
    "sodomy": "Содомия",
    "spirit-of-prophecy": "Дух пророчества",
    "spiritual-gifts": "Духовные дары",
    "spiritual-judgment": "Духовное суждение",
    "spiritual-rebirth": "Духовное возрождение",
    "temptation": "Искушение",
    "what-is-life": "Что такое жизнь",
    "wine": "Вино",
    "wisdom-cause": "Причина мудрости",
    "wisdom-fruit": "Плод мудрости",
    "wisdom-origin": "Источник мудрости",
    "wisdom-value": "Ценность мудрости",
    "womans-role": "Роль женщины",
    "word-of-god": "Слово Божье",
    "worldly-wisdom": "Мирская мудрость"
  }
}
