{
  "schema_version": 1,
  "locale": "nd",
  "name": "Northern Ndebele",
  "topics": {
    "adultery": "Ukuphinga",
    "authority-of-the-bible": "Igunya leBhayibheli",
    "baptism": "Ukubhajadiswa",
    "biblical-love": "Ithando leBhayibheli",
    "blessings-and-curses": "Iimbusiso neziqalekiso",
    "christian-clothing": "Izembatho zobuKrestu",
    "christian-offices": "Ama-ofisi wamaKrestu",
    "communion": "Isidlo",
    "conditional-security": "Ukuvikeleka okunemibandela",
    "dating": "Ukuthandana",
    "dietary-guidance": "Iinqophiso zokudla",
    "discipline": "Ukuziphatha",
    "education": "Ifundo",
    "effective-prayer": "Umthandazo ophumelelako",
    "family-planning": "Ukuhlela umndeni",
    "fear-not": "Ungasabi",
    "first-day": "Ilanga lokuthoma",
    "flattery": "Ukuthokoza",
    "free-will": "Ukuzikhethela",
    "gods-judgment": "Ukwahlulela kwakaZimu",
    "grace": "Umusa",
    "home-church": "Isonto leKhaya",
    "immutability": "Ukungatjhuguluki",
    "jesus-christs-deity": "UbuZimu bakaJesu Krestu",
    "jesus-christs-humanity": "Ubuntu bakaJesu Krestu",
    "leadership": "Uburholi",
    "longevity": "Ukuphila isikhathi eside",
    "mans-role": "Indima yomuntu",
    "marriage": "Umtjhado",
    "musics-influence": "Umthelela womvumo",
    "no-fellowship": "Akunabudlelwano",
    "no-one-is-good": "Akekho olungileko",
    "non-resistance": "Ukungajamelani",
    "not-under-the-law": "Ingasi ngaphasi komThetho",
    "obey-gods-commandments": "Lalela Imilayo kaZimu",
    "obey-government-laws": "Lalela imithetho karhulumende",
    "omnipotent": "onamandla woke",
    "omnipresent": "Ikhona yoke indawo",
    "omniscient": "Owazi koke",
    "orderly-home": "Ikhaya elihlelekileko",
    "ordinances": "ImiThetho",
    "prince-of-this-world": "IKosi yePhasi leli",
    "providence": "I-Providence",
    "renewing-of-the-mind": "Ukuvuselelwa kwengqondo",
    "repentance": "Ukuphenduka",
    "saved-by-faith": "Usindiswe ngokukholwa",
    "sodomy": "Ubufebe",
    "spirit-of-prophecy": "Umoya wesiPhorofido",
    "spiritual-gifts": "Izipho zomoya",
    "spiritual-judgment": "Ukwahlulela ngokomoya",
    "spiritual-rebirth": "Ukubelethwa kabutjha ngokomoya",
    "temptation": "Isilingo",
    "what-is-life": "Khuyini ipilo",
    "wine": "Iwayini",
    "wisdom-cause": "Ukuhlakanipha",
    "wisdom-fruit": "Isithelo sokuhlakanipha",
    "wisdom-origin": "Umsuka wokuhlakanipha",
    "wisdom-value": "Inani lokuhlakanipha",
    "womans-role": "Indima yomuntu wengubo",
    "word-of-god": "Ilizwi lakaZimu",
    "worldly-wisdom": "Ukuhlakanipha kwephasi"
  }
}
