{
  "schema_version": 1,
  "locale": "la",
  "name": "Latin",
  "topics": {
    "adultery": "Adulterium",
    "authority-of-the-bible": "Auctoritas Sacrae Scripturae",
    "baptism": "Baptismus",
    "biblical-love": "Caritas biblica",
    "blessings-and-curses": "Benedictiones et maledictiones",
    "christian-clothing": "Vestitus christianus",
    "christian-offices": "Officia ecclesiastica",
    "communion": "Communio",
    "conditional-security": "Securitas condicionata",
    "dating": "Congressus amatorii",
    "dietary-guidance": "Praecepta alimentaria",
    "discipline": "Disciplina",
    "education": "Educatio",
    "effective-prayer": "Oratio efficax",
    "family-planning": "Consilium familiae",
    "fear-not": "Noli timere",
    "first-day": "Dies primus",
    "flattery": "Adulatio",
    "free-will": "Liberum arbitrium",
    "gods-judgment": "Iudicium Dei",
    "grace": "Gratia",
    "home-church": "Ecclesia domestica",
    "immutability": "Immutabilitas",
    "jesus-christs-deity": "Divinitas Iesu Christi",
    "jesus-christs-humanity": "Humanitas Iesu Christi",
    "leadership": "Ductus",
    "longevity": "Longaevitas",
    "mans-role": "Munus viri",
    "marriage": "Matrimonium",
    "musics-influence": "Vis musicae",
    "no-fellowship": "Nulla communio",
    "no-one-is-good": "Nemo bonus est",
    "non-resistance": "Non resistentia",
    "not-under-the-law": "Non sub lege",
    "obey-gods-commandments": "Mandatis Dei oboedire",
    "obey-government-laws": "Legibus civitatis oboedire",
    "omnipotent": "Omnipotens",
    "omnipresent": "Omnipraesens",
    "omniscient": "Omniscius",
    "orderly-home": "Domus ordinata",
    "ordinances": "Ordinationes",
    "prince-of-this-world": "Princeps huius mundi",
    "providence": "Providentia",
    "renewing-of-the-mind": "Renovatio mentis",
    "repentance": "Paenitentia",
    "saved-by-faith": "Fide salvatus",
    "sodomy": "Sodomia",
    "spirit-of-prophecy": "Spiritus prophetiae",
    "spiritual-gifts": "Dona spiritualia",
    "spiritual-judgment": "Iudicium spirituale",
    "spiritual-rebirth": "Renascentia spiritualis",
    "temptation": "Tentatio",
    "what-is-life": "Quid est vita",
    "wine": "Vinum",
    "wisdom-cause": "Causa sapientiae",
    "wisdom-fruit": "Fructus sapientiae",
    "wisdom-origin": "Origo sapientiae",
    "wisdom-value": "Pretium sapientiae",
    "womans-role": "Munus mulieris",
    "word-of-god": "Verbum Dei",
    "worldly-wisdom": "Sapientia mundana"
  }
}
