{
  "schema_version": 1,
  "locale": "sr",
  "name": "Serbian",
  "topics": {
    "adultery": "Прељуба",
    "authority-of-the-bible": "Ауторитет Библије",
    "baptism": "Крштење",
    "biblical-love": "Библијска љубав",
    "blessings-and-curses": "Благослови и проклетства",
    "christian-clothing": "Хришћанско одевање",
    "christian-offices": "Хришћанске службе",
    "communion": "Причешће",
    "conditional-security": "Условна сигурност спасења",
    "dating": "Забављање",
    "dietary-guidance": "Смернице за исхрану",
    "discipline": "Дисциплина",
    "education": "Образовање",
    "effective-prayer": "Делотворна молитва",
    "family-planning": "Планирање породице",
    "fear-not": "Не бој се",
    "first-day": "Први дан",
    "flattery": "Ласкање",
    "free-will": "Слободна воља",
    "gods-judgment": "Божји суд",
    "grace": "Благодат",
    "home-church": "Кућна црква",
    "immutability": "Непроменљивост",
    "jesus-christs-deity": "Божанство Исуса Христа",
    "jesus-christs-humanity": "Човечанство Исуса Христа",
    "leadership": "Вођство",
    "longevity": "Дуговечност",
    "mans-role": "Улога мушкарца",
    "marriage": "Брак",
    "musics-influence": "Утицај музике",
    "no-fellowship": "Без заједништва",
    "no-one-is-good": "Нико није добар",
    "non-resistance": "Непротивљење",
    "not-under-the-law": "Нисмо под Законом",
    "obey-gods-commandments": "Послушност Божјим заповестима",
    "obey-government-laws": "Поштовање државних закона",
    "omnipotent": "Свемогући",
    "omnipresent": "Свеприсутан",
    "omniscient": "Свезнајући",
    "orderly-home": "Уређен дом",
    "ordinances": "Уредбе",
    "prince-of-this-world": "Кнез овога света",
    "providence": "Провиђење",
    "renewing-of-the-mind": "Обнављање ума",
    "repentance": "Покајање",
    "saved-by-faith": "Спасени вером",
    "sodomy": "Содомија",
    "spirit-of-prophecy": "Дух пророштва",
    "spiritual-gifts": "Духовни дарови",
    "spiritual-judgment": "Духовно расуђивање",
    "spiritual-rebirth": "Духовно препорођење",
    "temptation": "Искушење",
    "what-is-life": "Шта је живот",
    "wine": "Вино",
    "wisdom-cause": "Узрок мудрости",
    "wisdom-fruit": "Плод мудрости",
    "wisdom-origin": "Порекло мудрости",
    "wisdom-value": "Вредност мудрости",
    "womans-role": "Улога жене",
    "word-of-god": "Реч Божја",
    "worldly-wisdom": "Световна мудрост"
  }
}
