{
  "schema_version": 1,
  "locale": "syr",
  "name": "Syriac",
  "topics": {
    "adultery": "الزنا",
    "authority-of-the-bible": "سلطة الكتاب المقدس",
    "baptism": "المعمودية",
    "biblical-love": "الحب الكتابي",
    "blessings-and-curses": "البركات واللعنات",
    "christian-clothing": "ملابس مسيحية",
    "christian-offices": "المناصب الكنسية",
    "communion": "التناول",
    "conditional-security": "الأمان المشروط",
    "dating": "التعارف",
    "dietary-guidance": "التوجيه الغذائي",
    "discipline": "الانضباط",
    "education": "التعليم",
    "effective-prayer": "صلاة فعالة",
    "family-planning": "تنظيم الأسرة",
    "fear-not": "لا تخف",
    "first-day": "اليوم الأول",
    "flattery": "تملق",
    "free-will": "الإرادة الحرة",
    "gods-judgment": "حكم الله",
    "grace": "نعمة",
    "home-church": "الكنيسة المنزلية",
    "immutability": "الثبات",
    "jesus-christs-deity": "ألوهية يسوع المسيح",
    "jesus-christs-humanity": "إنسانية يسوع المسيح",
    "leadership": "القيادة",
    "longevity": "طول العمر",
    "mans-role": "دور الرجل",
    "marriage": "زواج",
    "musics-influence": "تأثير الموسيقى",
    "no-fellowship": "لا زمالة",
    "no-one-is-good": "لا يوجد أحد جيد",
    "non-resistance": "عدم المقاومة",
    "not-under-the-law": "ليس بموجب القانون",
    "obey-gods-commandments": "طاعة وصايا الله",
    "obey-government-laws": "الالتزام بقوانين الحكومة",
    "omnipotent": "القدير",
    "omnipresent": "موجود في كل مكان",
    "omniscient": "كلي العلم",
    "orderly-home": "منزل منظم",
    "ordinances": "المراسيم",
    "prince-of-this-world": "أمير هذا العالم",
    "providence": "العناية الإلهية",
    "renewing-of-the-mind": "تجديد العقل",
    "repentance": "التوبة",
    "saved-by-faith": "الخلاص بالإيمان",
    "sodomy": "اللواط",
    "spirit-of-prophecy": "روح النبوة",
    "spiritual-gifts": "المواهب الروحية",
    "spiritual-judgment": "الحكم الروحي",
    "spiritual-rebirth": "الولادة الروحية الجديدة",
    "temptation": "إغراء",
    "what-is-life": "ما هي الحياة",
    "wine": "النبيذ",
    "wisdom-cause": "سبب الحكمة",
    "wisdom-fruit": "فاكهة الحكمة",
    "wisdom-origin": "أصل الحكمة",
    "wisdom-value": "قيمة الحكمة",
    "womans-role": "دور المرأة",
    "word-of-god": "كلمة الله",
    "worldly-wisdom": "الحكمة الدنيوية"
  }
}
