{
  "schema_version": 1,
  "locale": "rmq",
  "name": "Calo",
  "topics": {
    "adultery": "Adulterio",
    "authority-of-the-bible": "Autoridad de la Biblia",
    "baptism": "Bautismo",
    "biblical-love": "Amor bíblico",
    "blessings-and-curses": "Bendiciones y maldiciones",
    "christian-clothing": "Vestimenta cristiana",
    "christian-offices": "Oficios cristianos",
    "communion": "Comunión",
    "conditional-security": "Seguridad condicional",
    "dating": "Noviazgo",
    "dietary-guidance": "Orientación alimentaria",
    "discipline": "Disciplina",
    "education": "Educación",
    "effective-prayer": "Oración eficaz",
    "family-planning": "Planificación familiar",
    "fear-not": "No temas",
    "first-day": "Primer día",
    "flattery": "Adulación",
    "free-will": "Libre albedrío",
    "gods-judgment": "Juicio de Dios",
    "grace": "Gracia",
    "home-church": "Iglesia en casa",
    "immutability": "Inmutabilidad",
    "jesus-christs-deity": "La divinidad de Jesucristo",
    "jesus-christs-humanity": "La humanidad de Jesucristo",
    "leadership": "Liderazgo",
    "longevity": "Longevidad",
    "mans-role": "El papel del hombre",
    "marriage": "Matrimonio",
    "musics-influence": "La influencia de la música",
    "no-fellowship": "Sin comunión",
    "no-one-is-good": "Nadie es bueno",
    "non-resistance": "No resistencia",
    "not-under-the-law": "No bajo la ley",
    "obey-gods-commandments": "Obedecer los mandamientos de Dios",
    "obey-government-laws": "Obedecer las leyes del gobierno",
    "omnipotent": "Omnipotente",
    "omnipresent": "Omnipresente",
    "omniscient": "Omnisciente",
    "orderly-home": "Hogar ordenado",
    "ordinances": "Ordenanzas",
    "prince-of-this-world": "Príncipe de este mundo",
    "providence": "Providencia",
    "renewing-of-the-mind": "Renovación de la mente",
    "repentance": "Arrepentimiento",
    "saved-by-faith": "Salvado por la fe",
    "sodomy": "Sodomía",
    "spirit-of-prophecy": "Espíritu de profecía",
    "spiritual-gifts": "Dones espirituales",
    "spiritual-judgment": "Juicio espiritual",
    "spiritual-rebirth": "Renacimiento espiritual",
    "temptation": "Tentación",
    "what-is-life": "Qué es la vida",
    "wine": "Vino",
    "wisdom-cause": "Causa de la sabiduría",
    "wisdom-fruit": "Fruto de la sabiduría",
    "wisdom-origin": "Origen de la sabiduría",
    "wisdom-value": "Valor de la sabiduría",
    "womans-role": "El papel de la mujer",
    "word-of-god": "Palabra de Dios",
    "worldly-wisdom": "Sabiduría mundana"
  }
}
