{
  "schema_version": 1,
  "locale": "tpi",
  "name": "Tok Pisin",
  "topics": {
    "adultery": "Pasin pamuk",
    "authority-of-the-bible": "Atoriti bilong Baibel",
    "baptism": "Baptais",
    "biblical-love": "Baibel Lav",
    "blessings-and-curses": "Ol blesing na ol tok nogut",
    "christian-clothing": "Kristen klos",
    "christian-offices": "Ol Kristen Opis",
    "communion": "Komunio",
    "conditional-security": "Kondisenel Sekyuriti",
    "dating": "Deit",
    "dietary-guidance": "Gaidens long Kaikai",
    "discipline": "Disiplin",
    "education": "Edukesen",
    "effective-prayer": "Gutpela Beten",
    "family-planning": "Famili Plening",
    "fear-not": "Noken pret",
    "first-day": "Namba wan de",
    "flattery": "Tok gris",
    "free-will": "Fri Will",
    "gods-judgment": "Kot bilong God",
    "grace": "Marimari bilong God",
    "home-church": "Haus Sios",
    "immutability": "No inap senis",
    "jesus-christs-deity": "God bilong Jisas Krais",
    "jesus-christs-humanity": "Pasin bilong Jisas Krais",
    "leadership": "Lidasip",
    "longevity": "Longpela laip",
    "mans-role": "Wok bilong man",
    "marriage": "Marit",
    "musics-influence": "Pawa bilong Musik",
    "no-fellowship": "Nogat Felosip",
    "no-one-is-good": "Nogat wanpela man i gutpela",
    "non-resistance": "Nogat Resistans",
    "not-under-the-law": "No Aninit long Lo",
    "obey-gods-commandments": "Bihainim Lo Bilong God",
    "obey-government-laws": "Bihainim Lo bilong Gavman",
    "omnipotent": "Omnipoten",
    "omnipresent": "Olgeta hap",
    "omniscient": "Save long olgeta samting",
    "orderly-home": "Gutpela Haus",
    "ordinances": "Ol Odinens",
    "prince-of-this-world": "Prins bilong dispela graun",
    "providence": "God i lukautim",
    "renewing-of-the-mind": "Mekim Tingting i kamap nupela gen",
    "repentance": "Tanim bel",
    "saved-by-faith": "Bilip i kisim bek",
    "sodomy": "Sodomi",
    "spirit-of-prophecy": "Spirit bilong tok profet",
    "spiritual-gifts": "Ol Presen Bilong Spirit",
    "spiritual-judgment": "Spiritual Jajmen",
    "spiritual-rebirth": "Kamap gen long sait bilong spirit",
    "temptation": "Traim",
    "what-is-life": "Laip em i wanem samting",
    "wine": "Wain",
    "wisdom-cause": "Savetingting As",
    "wisdom-fruit": "Frut bilong Savetingting",
    "wisdom-origin": "As bilong savetingting",
    "wisdom-value": "Gutpela tingting",
    "womans-role": "Wok bilong Meri",
    "word-of-god": "Tok bilong God",
    "worldly-wisdom": "Savetingting bilong dispela graun"
  }
}
