{
  "schema_version": 1,
  "locale": "hr",
  "name": "Croatian",
  "topics": {
    "adultery": "Preljub",
    "authority-of-the-bible": "Autoritet Biblije",
    "baptism": "Krštenje",
    "biblical-love": "Biblijska ljubav",
    "blessings-and-curses": "Blagoslovi i prokletstva",
    "christian-clothing": "Kršćanska odjeća",
    "christian-offices": "Kršćanske službe",
    "communion": "Pričest",
    "conditional-security": "Uvjetna sigurnost spasenja",
    "dating": "Izlasci",
    "dietary-guidance": "Dijetetske smjernice",
    "discipline": "Disciplina",
    "education": "Obrazovanje",
    "effective-prayer": "Učinkovita molitva",
    "family-planning": "Planiranje obitelji",
    "fear-not": "Ne boj se",
    "first-day": "Prvi dan",
    "flattery": "laskanje",
    "free-will": "Slobodna volja",
    "gods-judgment": "Božji sud",
    "grace": "Milost",
    "home-church": "Kućna crkva",
    "immutability": "Nepromjenjivost",
    "jesus-christs-deity": "Božanstvo Isusa Krista",
    "jesus-christs-humanity": "Ljudskost Isusa Krista",
    "leadership": "Vodstvo",
    "longevity": "Dugovječnost",
    "mans-role": "Uloga muškarca",
    "marriage": "Brak",
    "musics-influence": "Utjecaj glazbe",
    "no-fellowship": "Bez zajedništva",
    "no-one-is-good": "Nitko nije dobar",
    "non-resistance": "Neprotivljenje",
    "not-under-the-law": "Nismo pod Zakonom",
    "obey-gods-commandments": "Poslušnost Božjim zapovijedima",
    "obey-government-laws": "Poštivanje državnih zakona",
    "omnipotent": "Svemogući",
    "omnipresent": "Sveprisutan",
    "omniscient": "Sveznajući",
    "orderly-home": "Uređen dom",
    "ordinances": "Uredbe",
    "prince-of-this-world": "Knez ovoga svijeta",
    "providence": "providnost",
    "renewing-of-the-mind": "Obnova uma",
    "repentance": "Pokajanje",
    "saved-by-faith": "Spašeni vjerom",
    "sodomy": "Sodomija",
    "spirit-of-prophecy": "Duh proroštva",
    "spiritual-gifts": "Duhovni darovi",
    "spiritual-judgment": "Duhovni sud",
    "spiritual-rebirth": "Duhovno nanovo rođenje",
    "temptation": "Iskušenje",
    "what-is-life": "Što je Život",
    "wine": "vino",
    "wisdom-cause": "Uzrok mudrosti",
    "wisdom-fruit": "Plod mudrosti",
    "wisdom-origin": "Podrijetlo mudrosti",
    "wisdom-value": "Vrijednost mudrosti",
    "womans-role": "Uloga žene",
    "word-of-god": "Riječ Božja",
    "worldly-wisdom": "Svjetovna mudrost"
  }
}
