{
  "schema_version": 1,
  "locale": "mn",
  "name": "Mongolian",
  "topics": {
    "adultery": "Садар самуун",
    "authority-of-the-bible": "Библийн эрх мэдэл",
    "baptism": "Баптисм хүртэх",
    "biblical-love": "Библийн хайр",
    "blessings-and-curses": "Ерөөл ба хараал",
    "christian-clothing": "Христийн шашны хувцас",
    "christian-offices": "Христийн чуулганы албан тушаалууд",
    "communion": "Ариун зоог",
    "conditional-security": "Нөхцөлт авралын баталгаа",
    "dating": "Болзох",
    "dietary-guidance": "Хоолны заавар",
    "discipline": "Сахилга бат",
    "education": "Боловсрол",
    "effective-prayer": "Үр дүнтэй залбирал",
    "family-planning": "Гэр бүл төлөвлөлт",
    "fear-not": "Бүү ай",
    "first-day": "Эхний өдөр",
    "flattery": "Зусардах",
    "free-will": "Чөлөөт хүсэл",
    "gods-judgment": "Бурханы шүүлт",
    "grace": "Нигүүлсэл",
    "home-church": "Гэрийн сүм",
    "immutability": "Өөрчлөгдөхгүй байдал",
    "jesus-christs-deity": "Есүс Христийн бурханлаг чанар",
    "jesus-christs-humanity": "Есүс Христийн хүн чанар",
    "leadership": "Манлайлал",
    "longevity": "Урт наслалт",
    "mans-role": "Эрэгтэй хүний үүрэг",
    "marriage": "Гэрлэлт",
    "musics-influence": "Хөгжмийн нөлөө",
    "no-fellowship": "Нөхөрлөл байхгүй",
    "no-one-is-good": "Хэн ч сайн биш",
    "non-resistance": "Эсэргүүцэлгүй",
    "not-under-the-law": "Хуулийн дор биш",
    "obey-gods-commandments": "Бурханы зарлигуудыг дага",
    "obey-government-laws": "Төрийн хуулийг дагаж мөрдөөрэй",
    "omnipotent": "Бүхнийг чадагч",
    "omnipresent": "Хаа сайгүй байдаг",
    "omniscient": "Бүхнийг мэддэг",
    "orderly-home": "Эмх цэгцтэй гэр",
    "ordinances": "Захирамжууд",
    "prince-of-this-world": "Энэ дэлхийн ханхүү",
    "providence": "Бурханы халамж",
    "renewing-of-the-mind": "Оюун санааны шинэчлэл",
    "repentance": "Наманчлал",
    "saved-by-faith": "Итгэлээр аврагдсан",
    "sodomy": "Содоми",
    "spirit-of-prophecy": "Зөгнөлийн сүнс",
    "spiritual-gifts": "Сүнслэг бэлгүүд",
    "spiritual-judgment": "Сүнслэг шүүлт",
    "spiritual-rebirth": "Сүнслэг дахин төрөлт",
    "temptation": "Уруу таталт",
    "what-is-life": "Амьдрал гэж юу вэ",
    "wine": "Дарс",
    "wisdom-cause": "Мэргэн ухааны шалтгаан",
    "wisdom-fruit": "Мэргэн ухааны жимс",
    "wisdom-origin": "Мэргэн ухааны гарал үүсэл",
    "wisdom-value": "Мэргэн ухааны үнэ цэнэ",
    "womans-role": "Эмэгтэй хүний үүрэг",
    "word-of-god": "Бурханы Үг",
    "worldly-wisdom": "Дэлхийн мэргэн ухаан"
  }
}
