{
  "schema_version": 1,
  "locale": "got",
  "name": "Gothic",
  "topics": {
    "adultery": "Ehebruch",
    "authority-of-the-bible": "Autorität der Bibel",
    "baptism": "Taufe",
    "biblical-love": "Biblische Liebe",
    "blessings-and-curses": "Segen und Flüche",
    "christian-clothing": "Christliche Kleidung",
    "christian-offices": "Christliche Ämter",
    "communion": "Abendmahl",
    "conditional-security": "Bedingte Heilssicherheit",
    "dating": "Partnersuche",
    "dietary-guidance": "Ernährungsrichtlinien",
    "discipline": "Disziplin",
    "education": "Bildung",
    "effective-prayer": "Wirksames Gebet",
    "family-planning": "Familienplanung",
    "fear-not": "Fürchte dich nicht",
    "first-day": "Erster Tag",
    "flattery": "Schmeichelei",
    "free-will": "Freier Wille",
    "gods-judgment": "Gottes Gericht",
    "grace": "Gnade",
    "home-church": "Hausgemeinde",
    "immutability": "Unveränderlichkeit",
    "jesus-christs-deity": "Die Gottheit Jesu Christi",
    "jesus-christs-humanity": "Die Menschlichkeit Jesu Christi",
    "leadership": "Führung",
    "longevity": "Langlebigkeit",
    "mans-role": "Die Rolle des Mannes",
    "marriage": "Ehe",
    "musics-influence": "Der Einfluss der Musik",
    "no-fellowship": "Keine Gemeinschaft",
    "no-one-is-good": "Niemand ist gut",
    "non-resistance": "Gewaltlosigkeit",
    "not-under-the-law": "Nicht unter dem Gesetz",
    "obey-gods-commandments": "Gottes Gebote befolgen",
    "obey-government-laws": "Staatliche Gesetze befolgen",
    "omnipotent": "Allmächtig",
    "omnipresent": "Allgegenwärtig",
    "omniscient": "Allwissend",
    "orderly-home": "Geordnetes Zuhause",
    "ordinances": "Verordnungen",
    "prince-of-this-world": "Fürst dieser Welt",
    "providence": "Vorsehung",
    "renewing-of-the-mind": "Erneuerung des Sinnes",
    "repentance": "Buße",
    "saved-by-faith": "Durch Glauben gerettet",
    "sodomy": "Sodomie",
    "spirit-of-prophecy": "Geist der Prophetie",
    "spiritual-gifts": "Geistliche Gaben",
    "spiritual-judgment": "Geistliches Urteilsvermögen",
    "spiritual-rebirth": "Geistliche Wiedergeburt",
    "temptation": "Versuchung",
    "what-is-life": "Was ist das Leben",
    "wine": "Wein",
    "wisdom-cause": "Ursache der Weisheit",
    "wisdom-fruit": "Frucht der Weisheit",
    "wisdom-origin": "Ursprung der Weisheit",
    "wisdom-value": "Wert der Weisheit",
    "womans-role": "Die Rolle der Frau",
    "word-of-god": "Wort Gottes",
    "worldly-wisdom": "Weltliche Weisheit"
  }
}
