{
  "schema_version": 1,
  "locale": "ch",
  "name": "Chamorro",
  "topics": {
    "adultery": "Adulterio",
    "authority-of-the-bible": "I otdinariu na taotao gi i Biblia",
    "baptism": "Tinaitai",
    "biblical-love": "Guinaiya gi i Biblia",
    "blessings-and-curses": "Bendision yan Maldision",
    "christian-clothing": "Magagu na Mankristianu",
    "christian-offices": "Ofisinan Mankristianu",
    "communion": "Kumunion",
    "conditional-security": "Siguridåt Kondisionåt",
    "dating": "Manmalago'",
    "dietary-guidance": "Guiya i Neñkanu'",
    "discipline": "Disiplina",
    "education": "Edukasion",
    "effective-prayer": "Tinayuyot ni' Efekto",
    "family-planning": "Planon Familia",
    "fear-not": "Chamo Fanma'å'ñao",
    "first-day": "I fine'nana na diha",
    "flattery": "Manma'å'ñao",
    "free-will": "Libre na Disision",
    "gods-judgment": "I Sentensian Yu'os",
    "grace": "Grasia",
    "home-church": "Gima'Yu'os",
    "immutability": "Ti siña ma'apåsi",
    "jesus-christs-deity": "I Yu'os Jesukristo",
    "jesus-christs-humanity": "I Taotao-ña si Jesukristo",
    "leadership": "Lideråt",
    "longevity": "Lina'la'",
    "mans-role": "I Che'cho' i Lalåhi",
    "marriage": "Asagua",
    "musics-influence": "I Infektan i Musika",
    "no-fellowship": "Ti Manma'ayuda",
    "no-one-is-good": "taya' ni' hayi maolek",
    "non-resistance": "Ti-Resistensia",
    "not-under-the-law": "Ti Gi papa' i Lai",
    "obey-gods-commandments": "Osge i Tinago' Yu'os",
    "obey-government-laws": "Obidi i lai i gubetnamento",
    "omnipotent": "Todu i nina'siña",
    "omnipresent": "Todu i tiempo",
    "omniscient": "Todu Tumungo'",
    "orderly-home": "Guma' Manma'å'ñao",
    "ordinances": "Otdinansa siha",
    "prince-of-this-world": "Prinsipe gi este na Mundo",
    "providence": "I inadahen Yu'os",
    "renewing-of-the-mind": "Rininueba i Hinasso",
    "repentance": "Arepentimiento",
    "saved-by-faith": "Manma'åse' put i hinengge",
    "sodomy": "Sodomia",
    "spirit-of-prophecy": "Espiritun Prufesia",
    "spiritual-gifts": "Rigalu Espirituåt",
    "spiritual-judgment": "Huesgao Espirituat",
    "spiritual-rebirth": "Finatton Ta'lo gi Espirituåt",
    "temptation": "tentasion",
    "what-is-life": "Hafa i lina'la'",
    "wine": "Binu",
    "wisdom-cause": "Kausa put i tiningo'",
    "wisdom-fruit": "Frutan Tiningo'",
    "wisdom-origin": "I tutuhon i tiningo'",
    "wisdom-value": "I balotu-ña i tiningo'",
    "womans-role": "I Che'cho' i Palao'an",
    "word-of-god": "Fino' Yu'os",
    "worldly-wisdom": "Tiningo' gi i Mundo"
  }
}
