{
  "schema_version": 1,
  "locale": "sv",
  "name": "Swedish",
  "topics": {
    "adultery": "Äktenskapsbrott",
    "authority-of-the-bible": "Bibelns auktoritet",
    "baptism": "Dop",
    "biblical-love": "Biblisk kärlek",
    "blessings-and-curses": "Välsignelser och förbannelser",
    "christian-clothing": "Kristen klädsel",
    "christian-offices": "Kristna ämbeten",
    "communion": "Nattvard",
    "conditional-security": "Villkorad frälsningsvisshet",
    "dating": "Dejting",
    "dietary-guidance": "Kostråd",
    "discipline": "Disciplin",
    "education": "Utbildning",
    "effective-prayer": "Verksam bön",
    "family-planning": "Familjeplanering",
    "fear-not": "Frukta inte",
    "first-day": "Första dagen",
    "flattery": "Smicker",
    "free-will": "Fri vilja",
    "gods-judgment": "Guds dom",
    "grace": "Nåd",
    "home-church": "Husförsamling",
    "immutability": "Oföränderlighet",
    "jesus-christs-deity": "Jesu Kristi gudomlighet",
    "jesus-christs-humanity": "Jesu Kristi mänsklighet",
    "leadership": "Ledarskap",
    "longevity": "Livslängd",
    "mans-role": "Mannens roll",
    "marriage": "Äktenskap",
    "musics-influence": "Musikens inflytande",
    "no-fellowship": "Ingen gemenskap",
    "no-one-is-good": "Ingen är god",
    "non-resistance": "Icke-våld",
    "not-under-the-law": "Inte under lagen",
    "obey-gods-commandments": "Lyda Guds bud",
    "obey-government-laws": "Följa statens lagar",
    "omnipotent": "Allsmäktig",
    "omnipresent": "Allestädes närvarande",
    "omniscient": "Allvetande",
    "orderly-home": "Ordnat hem",
    "ordinances": "Förordningar",
    "prince-of-this-world": "Denna världens furste",
    "providence": "Försyn",
    "renewing-of-the-mind": "Sinnets förnyelse",
    "repentance": "Omvändelse",
    "saved-by-faith": "Frälst genom tro",
    "sodomy": "Sodomi",
    "spirit-of-prophecy": "Profetians ande",
    "spiritual-gifts": "Andliga gåvor",
    "spiritual-judgment": "Andlig bedömning",
    "spiritual-rebirth": "Andlig pånyttfödelse",
    "temptation": "Frestelse",
    "what-is-life": "Vad är livet",
    "wine": "Vin",
    "wisdom-cause": "Vishetens orsak",
    "wisdom-fruit": "Vishetens frukt",
    "wisdom-origin": "Vishetens ursprung",
    "wisdom-value": "Vishetens värde",
    "womans-role": "Kvinnans roll",
    "word-of-god": "Guds ord",
    "worldly-wisdom": "Världslig vishet"
  }
}
