{
  "schema_version": 1,
  "locale": "eu",
  "name": "Basque",
  "topics": {
    "adultery": "Adulterioa",
    "authority-of-the-bible": "Bibliaren agintaritza",
    "baptism": "Bataioa",
    "biblical-love": "Bibliako Maitasuna",
    "blessings-and-curses": "Bedeinkapenak eta Maldizioak",
    "christian-clothing": "Kristau jantziak",
    "christian-offices": "Kristau karguak",
    "communion": "Jaunartzea",
    "conditional-security": "Baldintzapeko salbamen-segurtasuna",
    "dating": "Hitzorduak",
    "dietary-guidance": "Orientazio dietetikoa",
    "discipline": "Diziplina",
    "education": "Hezkuntza",
    "effective-prayer": "Otoitz eraginkorra",
    "family-planning": "Familia Plangintza",
    "fear-not": "Beldurrik Ez",
    "first-day": "Lehen Eguna",
    "flattery": "Lausengua",
    "free-will": "Borondate Askea",
    "gods-judgment": "Jainkoaren epaia",
    "grace": "Grazia",
    "home-church": "Etxeko Eliza",
    "immutability": "Aldaezintasuna",
    "jesus-christs-deity": "Jesukristoren jainkotasuna",
    "jesus-christs-humanity": "Jesukristoren gizatasuna",
    "leadership": "Lidergoa",
    "longevity": "Iraupena",
    "mans-role": "Gizonaren rola",
    "marriage": "Ezkontza",
    "musics-influence": "Musikaren eragina",
    "no-fellowship": "Elkartasunik ez",
    "no-one-is-good": "Inor ez da ona",
    "non-resistance": "Erresistentziarik eza",
    "not-under-the-law": "Ez Legearen pean",
    "obey-gods-commandments": "Jainkoaren aginduak betetzea",
    "obey-government-laws": "Gobernuaren legeak betetzea",
    "omnipotent": "Ahalguztiduna",
    "omnipresent": "Nonahikoa",
    "omniscient": "Orojakin",
    "orderly-home": "Etxe ordenatua",
    "ordinances": "Ordenantzak",
    "prince-of-this-world": "Mundu honetako printzea",
    "providence": "Probidentzia",
    "renewing-of-the-mind": "Adimena berritzea",
    "repentance": "Damua",
    "saved-by-faith": "Fedearen bidez salbatua",
    "sodomy": "Sodomia",
    "spirit-of-prophecy": "Profeziaren espiritua",
    "spiritual-gifts": "Dohain espiritualak",
    "spiritual-judgment": "Judizio espirituala",
    "spiritual-rebirth": "Berpizkunde espirituala",
    "temptation": "Tentazioa",
    "what-is-life": "Zer da Bizitza",
    "wine": "Ardoa",
    "wisdom-cause": "Jakinduria Kausa",
    "wisdom-fruit": "Jakinduria Fruitua",
    "wisdom-origin": "Jakinduria Jatorria",
    "wisdom-value": "Jakinduria Balioa",
    "womans-role": "Emakumearen rola",
    "word-of-god": "Jainkoaren Hitza",
    "worldly-wisdom": "Munduko Jakinduria"
  }
}
