{
  "schema_version": 1,
  "locale": "sq",
  "name": "Albanian",
  "topics": {
    "adultery": "Tradhtia bashkëshortore",
    "authority-of-the-bible": "Autoriteti i Biblës",
    "baptism": "Pagëzimi",
    "biblical-love": "Dashuria Biblike",
    "blessings-and-curses": "Bekimet dhe mallkimet",
    "christian-clothing": "Veshje e krishterë",
    "christian-offices": "Shërbesat e krishtera",
    "communion": "Kungimi",
    "conditional-security": "Siguria e kushtëzuar e shpëtimit",
    "dating": "Takimi",
    "dietary-guidance": "Udhëzime dietike",
    "discipline": "Disiplinë",
    "education": "Arsimi",
    "effective-prayer": "Lutja efektive",
    "family-planning": "Planifikimi Familjar",
    "fear-not": "Mos kini frikë",
    "first-day": "Dita e Parë",
    "flattery": "Lajka",
    "free-will": "Vullneti i Lirë",
    "gods-judgment": "Gjykimi i Zotit",
    "grace": "Hiri",
    "home-church": "Kisha në shtëpi",
    "immutability": "Pandryshueshmëria",
    "jesus-christs-deity": "Hyjnia e Jezu Krishtit",
    "jesus-christs-humanity": "Natyra njerëzore e Jezu Krishtit",
    "leadership": "Lidershipi",
    "longevity": "Jetëgjatësia",
    "mans-role": "Roli i burrit",
    "marriage": "Martesa",
    "musics-influence": "Ndikimi i muzikës",
    "no-fellowship": "Asnjë shoqëri",
    "no-one-is-good": "Askush nuk është i mirë",
    "non-resistance": "Jo-rezistenca",
    "not-under-the-law": "Jo nën Ligj",
    "obey-gods-commandments": "Bindja ndaj urdhërimeve të Perëndisë",
    "obey-government-laws": "Bindja ndaj ligjeve shtetërore",
    "omnipotent": "I gjithëfuqishëm",
    "omnipresent": "I gjithëpranishëm",
    "omniscient": "i gjithëdijshëm",
    "orderly-home": "Shtëpi e rregullt",
    "ordinances": "Urdhëresat",
    "prince-of-this-world": "Princi i kësaj Bote",
    "providence": "Providencë",
    "renewing-of-the-mind": "Ripërtëritja e mendjes",
    "repentance": "Pendimi",
    "saved-by-faith": "Shpëtuar me anë të besimit",
    "sodomy": "Sodomi",
    "spirit-of-prophecy": "Fryma e profecisë",
    "spiritual-gifts": "Dhurata shpirtërore",
    "spiritual-judgment": "Gjykimi shpirtëror",
    "spiritual-rebirth": "Rilindja shpirtërore",
    "temptation": "Tundimi",
    "what-is-life": "Çfarë është Jeta",
    "wine": "Verë",
    "wisdom-cause": "Shkaku i mençurisë",
    "wisdom-fruit": "Fruti i mençurisë",
    "wisdom-origin": "Origjina e Urtësisë",
    "wisdom-value": "Vlera e mençurisë",
    "womans-role": "Roli i gruas",
    "word-of-god": "Fjala e Zotit",
    "worldly-wisdom": "Urtësia e kësaj bote"
  }
}
